,output_file,content,restriction,sub_content
0,三、,制造业,,制造业
1,（二 ),轻工业,,轻工业
2,1,非金属制品模具设计、加工、制造,,非金属制品模具设计、加工、制造
3,2,纸浆（年产木浆17万吨及以上，并建设相应的原料基地）,,纸浆（年产木浆17万吨及以上，并建设相应的原料基地）
4,3,皮革后整饰加工及其新技术设备制造,,皮革后整饰加工及其新技术设备制造
5,4,无汞碱锰二次电池、锂离子电池生产,,无汞碱锰二次电池、锂离子电池生产
6,5,高技术含量的特种工业缝纫机生产,,高技术含量的特种工业缝纫机生产
7,6,聚酰亚胺保鲜薄膜生产,,聚酰亚胺保鲜薄膜生产
8,7,新型、高效酶制剂生产,,新型、高效酶制剂生产
9,8,合成香料、单离香料生产,,合成香料、单离香料生产
10,9,替代氟利昂应用技术研究及推广,,替代氟利昂应用技术研究及推广
11,10,烟用二醋酸纤维素及丝束加工,,烟用二醋酸纤维素及丝束加工
12,（三 ),纺织工业,,纺织工业
13,1,纺织化纤木浆（年产10万吨及以上，并建设相应的原料基地）,,纺织化纤木浆（年产10万吨及以上，并建设相应的原料基地）
14,2,工业用特种纺织品,,工业用特种纺织品
15,3,高仿真化纤及高档织物面料的印染及后整理加工,,高仿真化纤及高档织物面料的印染及后整理加工
16,4,纺织用助剂、油剂、染化料生产,,纺织用助剂、油剂、染化料生产
17,（四 ),交通运输、邮电通信业,,交通运输、邮电通信业
18,1,铁路运输技术设备：机车车辆及主要部件设计与制造、线路设备设计与制造、高速铁路有关技术与设备制造、通信信号和运输安全监测设备制造、电气化铁路设备和器材制造,,铁路运输技术设备：机车车辆及主要部件设计与制造、线路设备设计与制造、高速铁路有关技术与设备制造、通信信号和运输安全监测设备制造、电气化铁路设备和器材制造
19,2,支线铁路、地方铁路及其桥梁、隧道、轮渡设施的建设、经营（不允许外商独资）,不允许外商独资,支线铁路、地方铁路及其桥梁、隧道、轮渡设施的建设、经营
20,3,公路、港口新型机械设备设计与制造,,公路、港口新型机械设备设计与制造
21,4,城市地铁及轻轨的建设、经营（中方控股或占主导地位）,中方控股或占主导地位,城市地铁及轻轨的建设、经营
22,5,公路、独立桥梁和隧道的建设、经营,,公路、独立桥梁和隧道的建设、经营
23,6,港口公用码头设施的建设、经营（中方控股或占主导地位）,中方控股或占主导地位,港口公用码头设施的建设、经营
24,7,民用机场的建设、经营（中方控股或占主导地位）,中方控股或占主导地位,民用机场的建设、经营
25,8,蜂窝移动通信交叉连接／码分多址（ＤＣＳ／ＣＤＭＡ）系统设备制造,,蜂窝移动通信交叉连接／码分多址（ＤＣＳ／ＣＤＭＡ）系统设备制造
26,9,25千兆比／秒（25ＧＢ／Ｓ）及以上光同步、微波同步数字系列传输设备制造,,25千兆比／秒（25ＧＢ／Ｓ）及以上光同步、微波同步数字系列传输设备制造
27,10,25千兆比／秒（25ＧＢ／Ｓ）光通信、无线通信、数据通信计量仪表制造,,25千兆比／秒（25ＧＢ／Ｓ）光通信、无线通信、数据通信计量仪表制造
28,11,异步转移模式（ＡＴＭ）交换机设备制造,,异步转移模式（ＡＴＭ）交换机设备制造
29,（五 ),煤炭工业,,煤炭工业
30,1,煤炭采掘运选设备设计与制造,,煤炭采掘运选设备设计与制造
31,2,煤炭开采与洗选（特种、稀有煤种由中方控股或占主导地位）,特种、稀有煤种由中方控股或占主导地位,煤炭开采与洗选
32,3,水煤浆、煤炭液化生产,,水煤浆、煤炭液化生产
33,4,煤炭综合开发利用,,煤炭综合开发利用
34,5,低热值燃料及伴生资源综合开发利用,,低热值燃料及伴生资源综合开发利用
35,6,煤炭管道运输,,煤炭管道运输
36,7,煤层气勘查、开发,,煤层气勘查、开发
37,（六 ),电力工业,,电力工业
38,1,单机容量30万千瓦及以上火电站的建设、经营,,单机容量30万千瓦及以上火电站的建设、经营
39,2,发电为主水电站的建设、经营,,发电为主水电站的建设、经营
40,3,核电站的建设、经营（中方控股或占主导地位）,中方控股或占主导地位,核电站的建设、经营
41,4,煤洁净燃烧技术电站的建设、经营,,煤洁净燃烧技术电站的建设、经营
42,5,新能源电站的建设、经营（包括太阳能、风能、磁能、地热能、潮汐能、生物质能等）,,新能源电站的建设、经营（包括太阳能、风能、磁能、地热能、潮汐能、生物质能等）
43,（七 ),黑色冶金工业,,黑色冶金工业
44,1,50吨及以上超高功率电炉（配备炉外精炼和连铸）、50吨及以上转炉炼钢,,50吨及以上超高功率电炉（配备炉外精炼和连铸）、50吨及以上转炉炼钢
45,2,不锈钢冶炼,,不锈钢冶炼
46,3,冷轧硅钢片生产,,冷轧硅钢片生产
47,4,热、冷轧不锈钢板生产,,热、冷轧不锈钢板生产
48,5,石油钢管,,石油钢管
49,6,废钢加工和处理,,废钢加工和处理
50,7,铁矿、锰矿采选,,铁矿、锰矿采选
51,8,直接还原铁和熔融还原铁生产,,直接还原铁和熔融还原铁生产
52,9,高铝矾土、硬质粘土矿开采及熟料生产,,高铝矾土、硬质粘土矿开采及熟料生产
53,10,针状焦、捣固焦和煤焦油深加工,,针状焦、捣固焦和煤焦油深加工
54,11,干熄焦生产,,干熄焦生产
55,（八 ),有色金属工业,,有色金属工业
56,1,单晶硅（直径8英寸及以上）、多晶硅生产,,单晶硅（直径8英寸及以上）、多晶硅生产
57,2,硬质合金、锡化合物、锑化合物生产,,硬质合金、锡化合物、锑化合物生产
58,3,有色金属复合材料、新型合金材料生产,,有色金属复合材料、新型合金材料生产
59,4,铜、铅、锌矿开采（不允许外商独资）,不允许外商独资,铜、铅、锌矿开采
60,5,铝矿开采（不允许外商独资），年产30万吨及以上氧化铝生产,不允许外商独资,铝矿开采，年产30万吨及以上氧化铝生产
61,6,稀土应用,,稀土应用
62,（九 ),石油、石油化工及化学工业,,石油、石油化工及化学工业
63,1,烧碱用离子膜生产,,烧碱用离子膜生产
64,2,年产60万吨及以上乙烯（中方控股或占主导地位）,中方控股或占主导地位,年产60万吨及以上乙烯
65,3,聚氯乙烯树脂（中方控股或占主导地位）,中方控股或占主导地位,聚氯乙烯树脂
66,4,乙烯副产品Ｃ5－Ｃ9产品的综合利用,,乙烯副产品Ｃ5－Ｃ9产品的综合利用
67,5,工程塑料及塑料合金,,工程塑料及塑料合金
68,6,合成材料的配套原料：双酚Ａ、丁苯吡胶乳、吡啶、44′二苯基甲烷二异氰酸酯、甲苯二异氰酸酯,,合成材料的配套原料：双酚Ａ、丁苯吡胶乳、吡啶、44′二苯基甲烷二异氰酸酯、甲苯二异氰酸酯
69,7,基本有机化工原料：苯、甲苯、二甲苯（对、邻、间）衍生物产品的综合利用,,基本有机化工原料：苯、甲苯、二甲苯（对、邻、间）衍生物产品的综合利用
70,8,合成橡胶：溶液丁苯橡胶、丁基橡胶、异戊橡胶、乙丙橡胶、丁二烯法氯丁橡胶、聚氨酯橡胶、丙烯酸橡胶、氯醇橡胶生产,,合成橡胶：溶液丁苯橡胶、丁基橡胶、异戊橡胶、乙丙橡胶、丁二烯法氯丁橡胶、聚氨酯橡胶、丙烯酸橡胶、氯醇橡胶生产
71,9,精细化工：染（颜）料、中间体、催化剂、助剂及石油添加剂新产品、新技术，染（颜）料商品化加工技术，电子、造纸用高科技化学品，食品添加剂、饲料添加剂，皮革化学品、油田助剂，表面活性剂，水处理剂，胶粘剂，无机纤维，无机粉体填料生产,,精细化工：染（颜）料、中间体、催化剂、助剂及石油添加剂新产品、新技术，染（颜）料商品化加工技术，电子、造纸用高科技化学品，食品添加剂、饲料添加剂，皮革化学品、油田助剂，表面活性剂，水处理剂，胶粘剂，无机纤维，无机粉体填料生产
72,10,氯化法钛白粉生产,,氯化法钛白粉生产
73,11,煤化工产品生产,,煤化工产品生产
74,12,废气、废液、废渣综合利用,,废气、废液、废渣综合利用
75,13,汽车尾气净化剂、催化剂及其它助剂生产,,汽车尾气净化剂、催化剂及其它助剂生产
76,14,增加石油采收率的三次采油新技术开发与运用（中方控股或占主导地位）,中方控股或占主导地位,增加石油采收率的三次采油新技术开发与运用
77,15,输油、输气管道及油库、石油专用码头的建设、经营（中方控股或占主导地位）,中方控股或占主导地位,输油、输气管道及油库、石油专用码头的建设、经营
78,（十 ),机械工业,,机械工业
79,1,高性能焊接机器人和高效焊装生产线设备制造,,高性能焊接机器人和高效焊装生产线设备制造
80,2,耐高温绝缘材料（绝缘等级为Ｆ、Ｈ级）及绝缘成型件生产,,耐高温绝缘材料（绝缘等级为Ｆ、Ｈ级）及绝缘成型件生产
81,3,井下无轨采、装、运设备，100吨及以上机械传动矿用自卸车，移动式破碎机，3000立方米／小时及以上斗轮挖掘机，5立方米及以上矿用装载机，全断面巷道掘进机制造,,井下无轨采、装、运设备，100吨及以上机械传动矿用自卸车，移动式破碎机，3000立方米／小时及以上斗轮挖掘机，5立方米及以上矿用装载机，全断面巷道掘进机制造
82,4,卷筒纸和对开以上单纸张多色胶印机制造,,卷筒纸和对开以上单纸张多色胶印机制造
83,5,机电井清洗设备制造和药物生产,,机电井清洗设备制造和药物生产
84,6,年产30万吨及以上合成氨、48万吨及以上尿素、30万吨及以上乙烯成套设备中的透平压缩机、混合造粒机制造（中方控股或占主导地位）,中方控股或占主导地位,年产30万吨及以上合成氨、48万吨及以上尿素、30万吨及以上乙烯成套设备中的透平压缩机、混合造粒机制造
85,7,新型纺织机械、新型造纸机械（含纸浆）等成套设备制造,,新型纺织机械、新型造纸机械（含纸浆）等成套设备制造
86,8,精密在线测量仪器开发与制造,,精密在线测量仪器开发与制造
87,9,安全生产及环保检测仪器新技术设备制造,,安全生产及环保检测仪器新技术设备制造
88,10,新型仪表元器件和材料（主要指智能型仪用传感器、仪用接插件、柔性线路板、光电开关、接近开关等新型仪用开关、仪用功能材料等）,,新型仪表元器件和材料（主要指智能型仪用传感器、仪用接插件、柔性线路板、光电开关、接近开关等新型仪用开关、仪用功能材料等）
89,11,重要基础机械、基础件、重大技术装备等研究、设计开发中心,,重要基础机械、基础件、重大技术装备等研究、设计开发中心
90,12,比例、伺服液压技术，低功率气动控制阀，填料静密封生产,,比例、伺服液压技术，低功率气动控制阀，填料静密封生产
91,13,精冲模、精密型腔模、模具标准件生产,,精冲模、精密型腔模、模具标准件生产
92,14,25万吨／日及以上城市污水处理设备，工业废水膜处理设备，上流式厌氧流化床设备和其他生物处理废水设备，粉煤灰砌块生产设备（5－10吨／年），废塑料再生处理设备，工业锅炉脱硫脱硝设备，大型耐高温、耐酸袋式除尘器制造,,25万吨／日及以上城市污水处理设备，工业废水膜处理设备，上流式厌氧流化床设备和其他生物处理废水设备，粉煤灰砌块生产设备（5－10吨／年），废塑料再生处理设备，工业锅炉脱硫脱硝设备，大型耐高温、耐酸袋式除尘器制造
93,15,精密轴承及各种主机专用轴承制造,,精密轴承及各种主机专用轴承制造
94,16,汽车关键零部件制造：制动器总成、驱动桥总成、变速器、柴油机燃油泵、活塞（含活塞环）、气门、液压挺杆、轴瓦、增压器、滤清器（三滤）、等速万向节、减震器、座椅调角器、车锁、后视镜、玻璃升降器、组合仪表、灯具及灯泡、专用高强度紧固件,,汽车关键零部件制造：制动器总成、驱动桥总成、变速器、柴油机燃油泵、活塞（含活塞环）、气门、液压挺杆、轴瓦、增压器、滤清器（三滤）、等速万向节、减震器、座椅调角器、车锁、后视镜、玻璃升降器、组合仪表、灯具及灯泡、专用高强度紧固件
95,17,汽车、摩托车模具（含冲模、注塑模、模压模等）、夹具（焊装夹具、检验夹具等）制造,,汽车、摩托车模具（含冲模、注塑模、模压模等）、夹具（焊装夹具、检验夹具等）制造
96,18,汽车、摩托车用铸锻毛坯件制造,,汽车、摩托车用铸锻毛坯件制造
97,19,汽车、摩托车技术研究、设计开发中心,,汽车、摩托车技术研究、设计开发中心
98,20,石油工业专用沙漠车等特种专用车生产,,石油工业专用沙漠车等特种专用车生产
99,21,摩托车关键零部件制造：化油器、磁电机、起动电机、灯具、盘式制动器,,摩托车关键零部件制造：化油器、磁电机、起动电机、灯具、盘式制动器
100,22,水质在线监测仪器的新技术设备制造,,水质在线监测仪器的新技术设备制造
101,23,特种防汛抢险机械和设备制造,,特种防汛抢险机械和设备制造
102,24,湿地土方及清淤机械制造,,湿地土方及清淤机械制造
103,25,10吨／小时及以上的饲料加工成套设备、关键部件生产,,10吨／小时及以上的饲料加工成套设备、关键部件生产
104,26,石油勘探开发新型仪器设备设计与制造,,石油勘探开发新型仪器设备设计与制造
105,（十一 ),电子工业,,电子工业
106,1,线宽035微米及以下大规模集成电路生产,,线宽035微米及以下大规模集成电路生产
107,2,新型电子元器件（含片式元器件）及电力电子元器件生产,,新型电子元器件（含片式元器件）及电力电子元器件生产
108,3,光电器件、敏感元器件及传感器生产,,光电器件、敏感元器件及传感器生产
109,4,大中型电子计算机制造,,大中型电子计算机制造
110,5,可兼容数字电视、高清晰度电视（ＨＤＴＶ）、数字磁带录放机生产,,可兼容数字电视、高清晰度电视（ＨＤＴＶ）、数字磁带录放机生产
111,6,半导体、光电子专用材料开发,,半导体、光电子专用材料开发
112,7,新型显示器件（平板显示器及显示屏）制造,,新型显示器件（平板显示器及显示屏）制造
113,8,计算机辅助设计（三维ＣＡＤ）、辅助测试（ＣＡＴ）、辅助制造（ＣＡＭ）、辅助工程（ＣＡＥ）系统及其他计算机应用系统制造,,计算机辅助设计（三维ＣＡＤ）、辅助测试（ＣＡＴ）、辅助制造（ＣＡＭ）、辅助工程（ＣＡＥ）系统及其他计算机应用系统制造
114,9,电子专用设备、仪器、工模具制造,,电子专用设备、仪器、工模具制造
115,10,水文数据采集仪器及设备制造,,水文数据采集仪器及设备制造
116,11,卫星通信系统设备制造,,卫星通信系统设备制造
117,12,数字交叉连接设备制造,,数字交叉连接设备制造
118,13,空中交通管制设备制造（不允许外商独资）,不允许外商独资,空中交通管制设备制造
119,14,大容量光、磁盘存储器及其部件开发与制造,,大容量光、磁盘存储器及其部件开发与制造
120,15,新型打印装置（激光打印机等）开发与制造,,新型打印装置（激光打印机等）开发与制造
121,16,数据通信多媒体系统设备制造,,数据通信多媒体系统设备制造
122,17,单模光纤生产,,单模光纤生产
123,18,接入网通信系统设备制造,,接入网通信系统设备制造
124,19,支撑通讯网的新技术设备制造,,支撑通讯网的新技术设备制造
125,20,宽带综合业务数字网设备（ＩＳＤＮ）制造,,宽带综合业务数字网设备（ＩＳＤＮ）制造
126,（十二 ),建筑材料、设备及其它非金属矿制品工业,,建筑材料、设备及其它非金属矿制品工业
127,1,日熔化500吨级及以上优质浮法玻璃生产线,,日熔化500吨级及以上优质浮法玻璃生产线
128,2,年产50万件及以上高档卫生瓷生产线及其配套的五金件、塑料件,,年产50万件及以上高档卫生瓷生产线及其配套的五金件、塑料件
129,3,新型建筑材料（墙体材料、装饰装修材料、防水材料、保温材料）,,新型建筑材料（墙体材料、装饰装修材料、防水材料、保温材料）
130,4,日产4000吨及以上水泥熟料新型干法水泥生产线（限于中西部地区）,,日产4000吨及以上水泥熟料新型干法水泥生产线（限于中西部地区）
131,5,散装水泥仓储运输设施,,散装水泥仓储运输设施
132,6,年产1万吨及以上玻璃纤维（池窑拉丝工艺生产线）及玻璃钢制品,,年产1万吨及以上玻璃纤维（池窑拉丝工艺生产线）及玻璃钢制品
133,7,无机非金属材料及制品（石英玻璃、人工晶体）,,无机非金属材料及制品（石英玻璃、人工晶体）
134,8,玻璃、陶瓷、玻璃纤维窑炉用高档耐火材料,,玻璃、陶瓷、玻璃纤维窑炉用高档耐火材料
135,9,平板玻璃深加工技术及设备制造,,平板玻璃深加工技术及设备制造
136,10,隧道挖掘机、城市地铁暗挖设备制造,,隧道挖掘机、城市地铁暗挖设备制造
137,11,城市卫生特种设备制造,,城市卫生特种设备制造
138,12,树木移载机械设备制造,,树木移载机械设备制造
139,13,路面铣平、翻修机械设备制造,,路面铣平、翻修机械设备制造
140,（十三 ),医药工业,,医药工业
141,1,受我国专利保护或行政保护的化学原料药，需进口的医药专用中间体,,受我国专利保护或行政保护的化学原料药，需进口的医药专用中间体
142,2,采用新技术设备生产解热镇痛药,,采用新技术设备生产解热镇痛药
143,3,维生素类：烟酸,,维生素类：烟酸
144,4,新型抗癌药物及新型心脑血管药,,新型抗癌药物及新型心脑血管药
145,5,药品制剂：采用缓释、控释、靶向、透皮吸收等新技术的新剂型、新产品,,药品制剂：采用缓释、控释、靶向、透皮吸收等新技术的新剂型、新产品
146,6,氨基酸类：丝氨酸、色氨酸、组氨酸等,,氨基酸类：丝氨酸、色氨酸、组氨酸等
147,7,新型药品包装材料、容器及先进的制药设备,,新型药品包装材料、容器及先进的制药设备
148,8,新型、高效、经济的避孕药具,,新型、高效、经济的避孕药具
149,9,中成药产品质量控制、改变剂型包装的新技术、新设备、新仪器,,中成药产品质量控制、改变剂型包装的新技术、新设备、新仪器
150,10,中药有效成分分析的新技术、提取的新工艺、新设备,,中药有效成分分析的新技术、提取的新工艺、新设备
151,11,采用生物工程技术生产的新型药物,,采用生物工程技术生产的新型药物
152,12,新型佐剂的开发应用,,新型佐剂的开发应用
153,13,肝炎、艾滋病及放射免疫类等诊断试剂生产,,肝炎、艾滋病及放射免疫类等诊断试剂生产
154,（十四 ),医疗器械制造业,,医疗器械制造业
155,1,具有中频技术、计算机控制技术和数字图象处理技术，辐射剂量小的80千瓦及以上医用Ｘ线机组,,具有中频技术、计算机控制技术和数字图象处理技术，辐射剂量小的80千瓦及以上医用Ｘ线机组
156,2,电子内窥镜,,电子内窥镜
157,3,医用导管,,医用导管
158,（十五 ),航天航空工业,,航天航空工业
159,1,民用飞机设计与制造（中方控股或占主导地位）,中方控股或占主导地位,民用飞机设计与制造
160,2,民用飞机零部件制造,,民用飞机零部件制造
161,3,航空发动机设计与制造（中方控股或占主导地位）,中方控股或占主导地位,航空发动机设计与制造
162,4,航空机载设备制造,,航空机载设备制造
163,5,轻型燃气轮机制造,,轻型燃气轮机制造
164,6,民用卫星设计与制造（中方控股或占主导地位）,中方控股或占主导地位,民用卫星设计与制造
165,7,民用卫星有效载荷制造（中方控股或占主导地位）,中方控股或占主导地位,民用卫星有效载荷制造
166,8,民用卫星零部件制造,,民用卫星零部件制造
167,9,民用卫星应用技术开发,,民用卫星应用技术开发
168,10,民用运载火箭设计与制造（中方控股或占主导地位）,中方控股或占主导地位,民用运载火箭设计与制造
169,（十六 ),新兴产业,,新兴产业
170,1,微电子技术,,微电子技术
171,2,新材料,,新材料
172,3,生物工程技术（不包括基因工程技术）,,生物工程技术（不包括基因工程技术）
173,4,信息、通信系统网络技术,,信息、通信系统网络技术
174,5,同位素、辐射及激光技术,,同位素、辐射及激光技术
175,6,海洋开发及海洋能开发技术,,海洋开发及海洋能开发技术
176,7,海水淡化及利用技术,,海水淡化及利用技术
177,8,节约能源开发技术,,节约能源开发技术
178,9,资源再生及综合利用技术,,资源再生及综合利用技术
179,10,环境污染治理工程及监测和治理技术,,环境污染治理工程及监测和治理技术
180,（十七 ),服务业,,服务业
181,1,国际经济、科技、环保信息咨询,,国际经济、科技、环保信息咨询
182,2,精密仪器设备维修、售后服务,,精密仪器设备维修、售后服务
183,3,高新技术、新产品开发中心的建设与企业孵化,,高新技术、新产品开发中心的建设与企业孵化
184,三、,制造业,,制造业
185,（一 ),轻工业,,轻工业
186,1,洗衣机、电冰箱、冰柜生产,,洗衣机、电冰箱、冰柜生产
187,2,合成脂肪醇、醇醚及醇醚硫酸盐,,合成脂肪醇、醇醚及醇醚硫酸盐
188,3,空调、冰箱用轴功率2千瓦以下压缩机生产,,空调、冰箱用轴功率2千瓦以下压缩机生产
189,（二 ),纺织工业,,纺织工业
190,1,常规切片纺的化纤抽丝,,常规切片纺的化纤抽丝
191,2,单线能力在2万吨／年以下粘胶短纤维生产,,单线能力在2万吨／年以下粘胶短纤维生产
192,（三 ),石油、石油化工及化学工业,,石油、石油化工及化学工业
193,1,钡盐生产,,钡盐生产
194,2,500万吨以下炼油厂建设,,500万吨以下炼油厂建设
195,3,斜交轮胎、旧轮胎（子午胎除外）翻新及低性能工业橡胶配件生产,,斜交轮胎、旧轮胎（子午胎除外）翻新及低性能工业橡胶配件生产
196,4,硫酸法钛白粉生产,,硫酸法钛白粉生产
197,（四 ),机械工业,,机械工业
198,1,一般涤纶长丝、短纤维设备制造,,一般涤纶长丝、短纤维设备制造
199,2,柴油发电机组制造,,柴油发电机组制造
200,3,各种普通磨料（含刚玉、碳化硅），直径400毫米以下砂轮及人造金刚石锯片生产,,各种普通磨料（含刚玉、碳化硅），直径400毫米以下砂轮及人造金刚石锯片生产
201,4,电钻、电动砂轮机生产,,电钻、电动砂轮机生产
202,5,普通碳钢焊条,,普通碳钢焊条
203,6,普通级标准紧固件、小型和中小型普通轴承,,普通级标准紧固件、小型和中小型普通轴承
204,7,普通铅酸蓄电池,,普通铅酸蓄电池
205,8,集装箱,,集装箱
206,9,电梯,,电梯
207,10,铝合金轮毂,,铝合金轮毂
208,（五 ),电子工业,,电子工业
209,1,卫星电视接收机及关键件,,卫星电视接收机及关键件
210,2,数字程控局用和用户交换机设备,,数字程控局用和用户交换机设备
211,（六 ),医药工业,,医药工业
212,1,氯霉素、洁霉素、庆大霉素、双氢链霉素、丁胺卡那霉素、盐酸四环素、土霉素、乙酰螺旋霉素、麦迪霉素、柱晶白霉素、红霉素、环丙氟哌酸、氟哌酸、氟嗪酸生产,,氯霉素、洁霉素、庆大霉素、双氢链霉素、丁胺卡那霉素、盐酸四环素、土霉素、乙酰螺旋霉素、麦迪霉素、柱晶白霉素、红霉素、环丙氟哌酸、氟哌酸、氟嗪酸生产
213,2,安乃近、阿斯匹林、扑热息痛、维生素Ｂ1、维生素Ｂ2、维生素Ｂ6生产,,安乃近、阿斯匹林、扑热息痛、维生素Ｂ1、维生素Ｂ2、维生素Ｂ6生产
214,（七 ),医疗器械制造业,,医疗器械制造业
215,1,中低档Ｂ型超声显像仪生产,,中低档Ｂ型超声显像仪生产
216,（八 ),运输服务业,,运输服务业
217,1,出租汽车（限于国内购车）,,出租汽车（限于国内购车）
