,output_file,content,restriction,sub_content
120,14,第三、四代轿车轮毂轴承（轴承内、外圈带法兰盘和传感器的轮毂轴承功能部件），高中档数控机床和加工中心轴承（加工中心具有三轴以上联动功能、定位重复精度为3-4μm），高速线材、板材轧机轴承（单途线材轧机轧速120m/s及以上、薄板轧机加工板厚度2mm及以上的支承和工作辊轴承），高速铁路轴承（行驶速度大于200km/h），振动值Z4以下低噪音轴承（Z4、Z4P、V4、V4P噪音级），各类轴承的P4、P2级轴承，风力发电机组轴承（2兆瓦以上风力发电机组主轴轴承、增速器轴承、发电机轴承等），航空轴承（航空发动机主轴轴承、起落架轴承、传动系统轴承、操纵系统轴承等）制造,,第三、四代轿车轮毂轴承（轴承内、外圈带法兰盘和传感器的轮毂轴承功能部件），高中档数控机床和加工中心轴承（加工中心具有三轴以上联动功能、定位重复精度为3-4μm），高速线材、板材轧机轴承（单途线材轧机轧速120m/s及以上、薄板轧机加工板厚度2mm及以上的支承和工作辊轴承），高速铁路轴承（行驶速度大于200km/h），振动值Z4以下低噪音轴承（Z4、Z4P、V4、V4P噪音级），各类轴承的P4、P2级轴承，风力发电机组轴承（2兆瓦以上风力发电机组主轴轴承、增速器轴承、发电机轴承等），航空轴承（航空发动机主轴轴承、起落架轴承、传动系统轴承、操纵系统轴承等）制造
121,15,高密度、高精度、形状复杂的粉末冶金零件及汽车、工程机械等用链条的制造,,高密度、高精度、形状复杂的粉末冶金零件及汽车、工程机械等用链条的制造
122,16,风电、高速列车用齿轮变速器，船用可变桨齿轮传动系统，大型、重载齿轮箱的制造,,风电、高速列车用齿轮变速器，船用可变桨齿轮传动系统，大型、重载齿轮箱的制造
123,17,耐高温绝缘材料（绝缘等级为F、Ｈ级）及绝缘成型件制造,,耐高温绝缘材料（绝缘等级为F、Ｈ级）及绝缘成型件制造
124,18,蓄能器胶囊、液压气动用橡塑密封件开发与制造,,蓄能器胶囊、液压气动用橡塑密封件开发与制造
125,19,高精度、高强度（12.9级以上）、异形、组合类紧固件制造,,高精度、高强度（12.9级以上）、异形、组合类紧固件制造
126,20,微型精密传动联结件（离合器）制造,,微型精密传动联结件（离合器）制造
127,21,大型轧机连接轴制造,,大型轧机连接轴制造
128,22,机床、工程机械、铁路机车装备等机械设备再制造及汽车零部件再制造,,机床、工程机械、铁路机车装备等机械设备再制造及汽车零部件再制造
129,（十八）,专用设备制造业,,专用设备制造业
130,1,矿山无轨采、装、运设备制造：200吨及以上机械传动矿用自卸车，移动式破碎机，5000立方米／小时及以上斗轮挖掘机，8立方米及以上矿用装载机，,,矿山无轨采、装、运设备制造：200吨及以上机械传动矿用自卸车，移动式破碎机，5000立方米／小时及以上斗轮挖掘机，8立方米及以上矿用装载机，
131,2,物探、测井设备制造：MEME地震检波器，数字遥测地震仪，数字成像、数控测井系统，水平井、定向井、钻机装置及器具，MWD随钻测井仪,,物探、测井设备制造：MEME地震检波器，数字遥测地震仪，数字成像、数控测井系统，水平井、定向井、钻机装置及器具，MWD随钻测井仪
132,3,石油勘探、钻井、集输设备制造：工作水深大于1500米的浮式钻井系统和浮式生产系统及配套海底采油、集输设备,,石油勘探、钻井、集输设备制造：工作水深大于1500米的浮式钻井系统和浮式生产系统及配套海底采油、集输设备
133,4,口径2米以上深度30米以上大口径旋挖钻机、直径1.2米以上顶管机、回拖力300吨以上大型非开挖铺设地下管线成套设备、地下连续墙施工钻机制造,,口径2米以上深度30米以上大口径旋挖钻机、直径1.2米以上顶管机、回拖力300吨以上大型非开挖铺设地下管线成套设备、地下连续墙施工钻机制造
134,5,520马力及以上大型推土机设计与制造,,520马力及以上大型推土机设计与制造
135,6,100立方米/小时及以上规格的清淤机、1000吨及以上挖泥船的挖泥装置设计与制造,,100立方米/小时及以上规格的清淤机、1000吨及以上挖泥船的挖泥装置设计与制造
136,7,防汛堤坝用混凝土防渗墙施工装备设计与制造,,防汛堤坝用混凝土防渗墙施工装备设计与制造
137,8,水下土石方施工机械制造：水深9米以下推土机、装载机、挖掘机等,,水下土石方施工机械制造：水深9米以下推土机、装载机、挖掘机等
138,9,公路桥梁养护、自动检测设备制造,,公路桥梁养护、自动检测设备制造
139,10,公路隧道营运监控、通风、防灾和救助系统设备制造,,公路隧道营运监控、通风、防灾和救助系统设备制造
140,11,铁路大型施工、铁路线路、桥梁、隧道维修养护机械和检查、监测设备及其关键零部件的设计与制造,,铁路大型施工、铁路线路、桥梁、隧道维修养护机械和检查、监测设备及其关键零部件的设计与制造
141,12,（沥青）油毡瓦设备、镀锌钢板等金属屋顶生产设备制造,,（沥青）油毡瓦设备、镀锌钢板等金属屋顶生产设备制造
142,13,环保节能型现场喷涂聚氨酯防水保温系统设备、聚氨酯密封膏配制技术与设备、改性硅酮密封膏配制技术和生产设备制造,,环保节能型现场喷涂聚氨酯防水保温系统设备、聚氨酯密封膏配制技术与设备、改性硅酮密封膏配制技术和生产设备制造
143,14,高精度带材轧机（厚度精度10微米）设计与制造,,高精度带材轧机（厚度精度10微米）设计与制造
144,15,多元素、细颗粒、难选冶金属矿产的选矿装置制造,,多元素、细颗粒、难选冶金属矿产的选矿装置制造
145,16,100万吨/年及以上乙烯成套设备中的关键设备制造：年处理能力40万吨以上混合造粒机，直径1000毫米及以上螺旋卸料离心机，小流量高扬程离心泵,,100万吨/年及以上乙烯成套设备中的关键设备制造：年处理能力40万吨以上混合造粒机，直径1000毫米及以上螺旋卸料离心机，小流量高扬程离心泵
146,17,大型煤化工成套设备制造（限于合资、合作）,限于合资、合作,大型煤化工成套设备制造
147,18,金属制品模具（铜、铝、钛、锆的管、棒、型材挤压模具）设计、制造,,金属制品模具（铜、铝、钛、锆的管、棒、型材挤压模具）设计、制造
148,19,汽车车身外覆盖件冲压模具，汽车仪表板、保险杠等大型注塑模具，汽车及摩托车夹具、检具设计与制造,,汽车车身外覆盖件冲压模具，汽车仪表板、保险杠等大型注塑模具，汽车及摩托车夹具、检具设计与制造
149,20,汽车动力电池专用生产设备的设计与制造,,汽车动力电池专用生产设备的设计与制造
150,21,精密模具（冲压模具精度高于0.02毫米、型腔模具精度高于0.05毫米）设计与制造,,精密模具（冲压模具精度高于0.02毫米、型腔模具精度高于0.05毫米）设计与制造
151,22,非金属制品模具设计与制造,,非金属制品模具设计与制造
152,23,6万瓶/小时及以上啤酒灌装设备、5万瓶/小时及以上饮料中温及热灌装设备、3.6万瓶/小时及以上无菌灌装设备制造,,6万瓶/小时及以上啤酒灌装设备、5万瓶/小时及以上饮料中温及热灌装设备、3.6万瓶/小时及以上无菌灌装设备制造
153,24,氨基酸、酶制剂、食品添加剂等生产技术及关键设备制造,,氨基酸、酶制剂、食品添加剂等生产技术及关键设备制造
154,25,10吨/小时及以上的饲料加工成套设备及关键部件制造,,10吨/小时及以上的饲料加工成套设备及关键部件制造
155,26,楞高0.75毫米及以下的轻型瓦楞纸板及纸箱设备制造,,楞高0.75毫米及以下的轻型瓦楞纸板及纸箱设备制造
156,27,单张纸多色胶印机（幅宽≥750毫米，印刷速度：单面多色≥16000张/小时，双面多色≥13000张/小时）制造,,单张纸多色胶印机（幅宽≥750毫米，印刷速度：单面多色≥16000张/小时，双面多色≥13000张/小时）制造
157,28,单幅单纸路卷筒纸平版印刷机印刷速度大于75000对开张/小时（787×880毫米）、双幅单纸路卷筒纸平版印刷机印刷速度大于170000对开张/小时（787×880毫米）、商业卷筒纸平版印刷机印刷速度大于50000对开张/小时（787×880毫米）制造,,单幅单纸路卷筒纸平版印刷机印刷速度大于75000对开张/小时（787×880毫米）、双幅单纸路卷筒纸平版印刷机印刷速度大于170000对开张/小时（787×880毫米）、商业卷筒纸平版印刷机印刷速度大于50000对开张/小时（787×880毫米）制造
158,29,多色宽幅柔性版印刷机（印刷宽度≥1300毫米，印刷速度≥350米/秒），喷墨数字印刷机（出版用：印刷速度≥150米/分，分辨率≥600dpi；包装用：印刷速度≥30米/分，分辨率≥1000dpi；可变数据用：印刷速度≥100米/分，分辨率≥300dpi）制造,,多色宽幅柔性版印刷机（印刷宽度≥1300毫米，印刷速度≥350米/秒），喷墨数字印刷机（出版用：印刷速度≥150米/分，分辨率≥600dpi；包装用：印刷速度≥30米/分，分辨率≥1000dpi；可变数据用：印刷速度≥100米/分，分辨率≥300dpi）制造
159,30,计算机墨色预调、墨色遥控、水墨速度跟踪、印品质量自动检测和跟踪系统、无轴传动技术、速度在75000张/小时的高速自动接纸机、给纸机和可以自动遥控调节的高速折页机、自动套印系统、冷却装置、加硅系统、调偏装置等制造,,计算机墨色预调、墨色遥控、水墨速度跟踪、印品质量自动检测和跟踪系统、无轴传动技术、速度在75000张/小时的高速自动接纸机、给纸机和可以自动遥控调节的高速折页机、自动套印系统、冷却装置、加硅系统、调偏装置等制造
160,31,电子枪自动镀膜机制造,,电子枪自动镀膜机制造
161,32,平板玻璃深加工技术及设备制造,,平板玻璃深加工技术及设备制造
162,33,新型造纸机械（含纸浆）等成套设备制造,,新型造纸机械（含纸浆）等成套设备制造
163,34,皮革后整饰新技术设备制造,,皮革后整饰新技术设备制造
164,35,农产品加工及储藏新设备开发与制造：粮食、油料、蔬菜、干鲜果品、肉食品、水产品等产品的加工储藏、保鲜、分级、包装、干燥等新设备，农产品品质检测仪器设备，农产品品质无损伤检测仪器设备，流变仪，粉质仪，超微粉碎设备，高效脱水设备，五效以上高效果汁浓缩设备，粉体食品物料杀菌设备，固态及半固态食品无菌包装设备，碟片式分离离心机,,农产品加工及储藏新设备开发与制造：粮食、油料、蔬菜、干鲜果品、肉食品、水产品等产品的加工储藏、保鲜、分级、包装、干燥等新设备，农产品品质检测仪器设备，农产品品质无损伤检测仪器设备，流变仪，粉质仪，超微粉碎设备，高效脱水设备，五效以上高效果汁浓缩设备，粉体食品物料杀菌设备，固态及半固态食品无菌包装设备，碟片式分离离心机
165,36,农业机械制造：农业设施设备（温室自动灌溉设备、营养液自动配置与施肥设备、高效蔬菜育苗设备、土壤养分分析仪器），配套发动机功率120千瓦以上拖拉机及配套农具，低油耗低噪音低排放柴油机，大型拖拉机配套的带有残余雾粒回收装置的喷雾机，高性能水稻插秧机，棉花采摘机及棉花采摘台，适应多种行距的自走式玉米联合收割机（液压驱动或机械驱动），油菜籽收获机，甘蔗收割机，甜菜收割机,,农业机械制造：农业设施设备（温室自动灌溉设备、营养液自动配置与施肥设备、高效蔬菜育苗设备、土壤养分分析仪器），配套发动机功率120千瓦以上拖拉机及配套农具，低油耗低噪音低排放柴油机，大型拖拉机配套的带有残余雾粒回收装置的喷雾机，高性能水稻插秧机，棉花采摘机及棉花采摘台，适应多种行距的自走式玉米联合收割机（液压驱动或机械驱动），油菜籽收获机，甘蔗收割机，甜菜收割机
166,37,林业机具新技术设备制造,,林业机具新技术设备制造
167,39,农用废物的资源化利用及规模化畜禽养殖废物的资源化利用设备制造,,农用废物的资源化利用及规模化畜禽养殖废物的资源化利用设备制造
168,40,节肥、节（农）药、节水型农业技术设备制造,,节肥、节（农）药、节水型农业技术设备制造
169,41,机电井清洗设备及清洗药物生产设备制造,,机电井清洗设备及清洗药物生产设备制造
170,42,电子内窥镜制造,,电子内窥镜制造
171,43,眼底摄影机制造,,眼底摄影机制造
172,44,医用成像设备（高场强超导型磁共振成像设备、X线计算机断层成像设备、数字化彩色超声诊断设备等)关键部件的制造,,医用成像设备（高场强超导型磁共振成像设备、X线计算机断层成像设备、数字化彩色超声诊断设备等)关键部件的制造
173,45,医用超声换能器（3D）制造,,医用超声换能器（3D）制造
174,46,硼中子俘获治疗设备制造,,硼中子俘获治疗设备制造
175,47,图像引导适型调强放射治疗系统制造,,图像引导适型调强放射治疗系统制造
176,48,血液透析机、血液过滤机制造,,血液透析机、血液过滤机制造
177,49,全自动酶免系统（含加样、酶标、洗板、孵育、数据后处理等部分功能）设备制造,,全自动酶免系统（含加样、酶标、洗板、孵育、数据后处理等部分功能）设备制造
178,50,药品质量控制新技术、新设备制造,,药品质量控制新技术、新设备制造
179,51,天然药物有效物质分析的新技术、提取的新工艺、新设备开发与制造,,天然药物有效物质分析的新技术、提取的新工艺、新设备开发与制造
180,52,非PVC医用输液袋多层共挤水冷式薄膜吹塑装备制造,,非PVC医用输液袋多层共挤水冷式薄膜吹塑装备制造
181,53,新型纺织机械、关键零部件及纺织检测、实验仪器开发与制造,,新型纺织机械、关键零部件及纺织检测、实验仪器开发与制造
182,54,电脑提花人造毛皮机制造,,电脑提花人造毛皮机制造
183,55,太阳能电池生产专用设备制造,,太阳能电池生产专用设备制造
184,56,大气污染防治设备制造：耐高温及耐腐蚀滤料、低NOx燃烧装置、烟气脱氮催化剂及脱氮成套装置、工业有机废气净化设备、柴油车排气净化装置、含重金属废气处理装置,,大气污染防治设备制造：耐高温及耐腐蚀滤料、低NOx燃烧装置、烟气脱氮催化剂及脱氮成套装置、工业有机废气净化设备、柴油车排气净化装置、含重金属废气处理装置
185,57,水污染防治设备制造：卧式螺旋离心脱水机、膜及膜材料、50kg/h以上的臭氧发生器、10kg/h以上的二氧化氯发生器、紫外消毒装置、农村小型生活污水处理设备、含重金属废水处理装置,,水污染防治设备制造：卧式螺旋离心脱水机、膜及膜材料、50kg/h以上的臭氧发生器、10kg/h以上的二氧化氯发生器、紫外消毒装置、农村小型生活污水处理设备、含重金属废水处理装置
186,58,固体废物处理处置设备制造：污水处理厂污泥处置及资源利用设备、日处理量500吨以上垃圾焚烧成套设备、垃圾填埋渗滤液处理技术装备、垃圾填埋场防渗土工膜、建筑垃圾处理和资源化利用装备、危险废物处理装置、垃圾填埋场沼气发电装置、废钢铁处理设备、污染土壤修复设备,,固体废物处理处置设备制造：污水处理厂污泥处置及资源利用设备、日处理量500吨以上垃圾焚烧成套设备、垃圾填埋渗滤液处理技术装备、垃圾填埋场防渗土工膜、建筑垃圾处理和资源化利用装备、危险废物处理装置、垃圾填埋场沼气发电装置、废钢铁处理设备、污染土壤修复设备
187,59,铝工业赤泥综合利用设备开发与制造,,铝工业赤泥综合利用设备开发与制造
188,60,尾矿综合利用设备制造,,尾矿综合利用设备制造
189,61,废旧塑料、电器、橡胶、电池回收处理再生利用设备制造,,废旧塑料、电器、橡胶、电池回收处理再生利用设备制造
190,62,废旧纺织品回收处理设备制造,,废旧纺织品回收处理设备制造
191,63,废旧机电产品再制造设备制造,,废旧机电产品再制造设备制造
192,64,废旧轮胎综合利用装置制造,,废旧轮胎综合利用装置制造
193,65,水生生态系统的环境保护技术、设备制造,,水生生态系统的环境保护技术、设备制造
194,66,移动式组合净水设备制造,,移动式组合净水设备制造
195,67,非常规水处理、重复利用设备与水质监测仪器,,非常规水处理、重复利用设备与水质监测仪器
196,68,工业水管网和设备（器具）的检漏设备和仪器,,工业水管网和设备（器具）的检漏设备和仪器
197,69,日产10万立方米及以上海水淡化及循环冷却技术和成套设备开发与制造,,日产10万立方米及以上海水淡化及循环冷却技术和成套设备开发与制造
198,70,特种气象观测及分析设备制造,,特种气象观测及分析设备制造
199,71,地震台站、台网和流动地震观测技术系统开发及仪器设备制造,,地震台站、台网和流动地震观测技术系统开发及仪器设备制造
200,72,三鼓及以上子午线轮胎成型机制造,,三鼓及以上子午线轮胎成型机制造
201,73,滚动阻力试验机、轮胎噪音试验室制造,,滚动阻力试验机、轮胎噪音试验室制造
202,74,供热计量、温控装置新技术设备制造,,供热计量、温控装置新技术设备制造
203,75,氢能制备与储运设备及检查系统制造,,氢能制备与储运设备及检查系统制造
204,76,新型重渣油气化雾化喷嘴、漏汽率0.5%及以下高效蒸汽疏水阀、1000℃及以上高温陶瓷换热器制造,,新型重渣油气化雾化喷嘴、漏汽率0.5%及以下高效蒸汽疏水阀、1000℃及以上高温陶瓷换热器制造
205,77,海上溢油回收装置制造,,海上溢油回收装置制造
206,78,低浓度煤矿瓦斯和乏风利用设备制造,,低浓度煤矿瓦斯和乏风利用设备制造
207,（十九）,交通运输设备制造业,,交通运输设备制造业
208,1,汽车发动机制造及发动机研发机构建设：升功率不低于70千瓦的汽油发动机、升功率不低于50千瓦的排量3升以下柴油发动机、升功率不低于40千瓦的排量3升以上柴油发动机、燃料电池和混合燃料等新能源发动机,,汽车发动机制造及发动机研发机构建设：升功率不低于70千瓦的汽油发动机、升功率不低于50千瓦的排量3升以下柴油发动机、升功率不低于40千瓦的排量3升以上柴油发动机、燃料电池和混合燃料等新能源发动机
209,2,汽车关键零部件制造及关键技术研发：双离合器变速器（DCT）、电控机械变速器（AMT）、汽油发动机涡轮增压器、粘性连轴器（四轮驱动用）、自动变速器执行器(电磁阀)、液力缓速器、电涡流缓速器、汽车安全气囊用气体发生器、燃油共轨喷射技术（最大喷射压力大于2000帕）、可变截面涡轮增压技术（VGT）、可变喷嘴涡轮增压技术（VNT）、达到中国Ⅴ阶段污染物排放标准的发动机排放控制装置、智能扭矩管理系统（ITM）及耦合器总成、线控转向系统、柴油机颗粒捕捉器、低地板大型客车专用车桥、吸能式转向系统、大中型客车变频空调系统、汽车用特种橡胶配件，以及上述零部件的关键零件、部件,,汽车关键零部件制造及关键技术研发：双离合器变速器（DCT）、电控机械变速器（AMT）、汽油发动机涡轮增压器、粘性连轴器（四轮驱动用）、自动变速器执行器(电磁阀)、液力缓速器、电涡流缓速器、汽车安全气囊用气体发生器、燃油共轨喷射技术（最大喷射压力大于2000帕）、可变截面涡轮增压技术（VGT）、可变喷嘴涡轮增压技术（VNT）、达到中国Ⅴ阶段污染物排放标准的发动机排放控制装置、智能扭矩管理系统（ITM）及耦合器总成、线控转向系统、柴油机颗粒捕捉器、低地板大型客车专用车桥、吸能式转向系统、大中型客车变频空调系统、汽车用特种橡胶配件，以及上述零部件的关键零件、部件
210,3,汽车电子装置制造与研发：发动机和底盘电子控制系统及关键零部件，车载电子技术（汽车信息系统和导航系统），汽车电子总线网络技术（限于合资），电子控制系统的输入（传感器和采样系统）输出（执行器）部件，电动助力转向系统电子控制器（限于合资），嵌入式电子集成系统（限于合资、合作）、电控式空气弹簧，电子控制式悬挂系统，电子气门系统装置，电子组合仪表，ABS/TCS/ESP系统，电路制动系统（BBW），变速器电控单元（TCU），轮胎气压监测系统（TPMS），车载故障诊断仪（OBD），发动机防盗系统，自动避撞系统，汽车、摩托车型试验及维修用检测系统,限于合资 限于合资 限于合资、合作,汽车电子装置制造与研发：发动机和底盘电子控制系统及关键零部件，车载电子技术（汽车信息系统和导航系统），汽车电子总线网络技术，电子控制系统的输入（传感器和采样系统）输出（执行器）部件，电动助力转向系统电子控制器，嵌入式电子集成系统、电控式空气弹簧，电子控制式悬挂系统，电子气门系统装置，电子组合仪表，ABS/TCS/ESP系统，电路制动系统（BBW），变速器电控单元（TCU），轮胎气压监测系统（TPMS），车载故障诊断仪（OBD），发动机防盗系统，自动避撞系统，汽车、摩托车型试验及维修用检测系统
211,4,新能源汽车关键零部件制造：能量型动力电池（能量密度≥110Wh/kg，循环寿命≥2000次，外资比例不超过50%)，电池正极材料（比容量≥150mAh/g，循环寿命2000次不低于初始放电容量的80%），电池隔膜（厚度15-40μm，孔隙率40%-60%）；电池管理系统，电机管理系统，电动汽车电控集成；电动汽车驱动电机（峰值功率密度≥2.5kW/kg，高效区：65%工作区效率≥80%），车用DC/DC（输入电压100V-400V），大功率电子器件（IGBT，电压等级≥600V，电流≥300A）；插电式混合动力机电耦合驱动系统,能量密度≥110Wh/kg，循环寿命≥2000次，外资比例不超过50%,新能源汽车关键零部件制造：能量型动力电池（能量密度≥110Wh/kg，循环寿命≥2000次，外资比例不超过50%)，电池正极材料（比容量≥150mAh/g，循环寿命2000次不低于初始放电容量的80%），电池隔膜（厚度15-40μm，孔隙率40%-60%）；电池管理系统，电机管理系统，电动汽车电控集成；电动汽车驱动电机（峰值功率密度≥2.5kW/kg，高效区：65%工作区效率≥80%），车用DC/DC（输入电压100V-400V），大功率电子器件（IGBT，电压等级≥600V，电流≥300A）；插电式混合动力机电耦合驱动系统
212,5,大排量（排量＞250ml）摩托车关键零部件制造：摩托车电控燃油喷射技术（限于合资、合作）、达到中国摩托车Ⅲ阶段污染物排放标准的发动机排放控制装置,限于合资、合作,大排量（排量＞250ml）摩托车关键零部件制造：摩托车电控燃油喷射技术、达到中国摩托车Ⅲ阶段污染物排放标准的发动机排放控制装置
