,output_file,content,restriction,sub_content
213,6,轨道交通运输设备（限于合资、合作）：高速铁路、铁路客运专线、城际铁路、干线铁路及城市轨道交通运输设备的整车和关键零部件（牵引传动系统、控制系统、制动系统）的研发、设计与制造；高速铁路、铁路客运专线、城际铁路及城市轨道交通乘客服务设施和设备的研发、设计与制造，信息化建设中有关信息系统的设计与研发；高速铁路、铁路客运专线、城际铁路的轨道和桥梁设备研发、设计与制造，轨道交通运输通信信号系统的研发、设计与制造，电气化铁路设备和器材制造、铁路噪声和振动控制技术与研发、铁路客车排污设备制造、铁路运输安全监测设备制造,限于合资、合作,轨道交通运输设备：高速铁路、铁路客运专线、城际铁路、干线铁路及城市轨道交通运输设备的整车和关键零部件（牵引传动系统、控制系统、制动系统）的研发、设计与制造；高速铁路、铁路客运专线、城际铁路及城市轨道交通乘客服务设施和设备的研发、设计与制造，信息化建设中有关信息系统的设计与研发；高速铁路、铁路客运专线、城际铁路的轨道和桥梁设备研发、设计与制造，轨道交通运输通信信号系统的研发、设计与制造，电气化铁路设备和器材制造、铁路噪声和振动控制技术与研发、铁路客车排污设备制造、铁路运输安全监测设备制造
214,7,民用飞机设计、制造与维修：干线、支线飞机（中方控股），通用飞机（限于合资、合作）,中方控股 限于合资、合作,民用飞机设计、制造与维修：干线、支线飞机，通用飞机
215,8,民用飞机零部件制造与维修,,民用飞机零部件制造与维修
216,9,民用直升机设计与制造：3吨级及以上（中方控股），3吨级以下（限于合资、合作）,中方控股 限于合资、合作,民用直升机设计与制造：3吨级及以上，3吨级以下
217,10,民用直升机零部件制造,,民用直升机零部件制造
218,11,地面、水面效应飞机制造（中方控股）,中方控股,地面、水面效应飞机制造
219,12,无人机、浮空器设计与制造（中方控股）,中方控股,无人机、浮空器设计与制造
220,13,航空发动机及零部件、航空辅助动力系统设计、制造与维修（限于合资、合作）,限于合资、合作,航空发动机及零部件、航空辅助动力系统设计、制造与维修
221,14,民用航空机载设备设计与制造（限于合资、合作）,限于合资、合作,民用航空机载设备设计与制造
222,15,航空地面设备制造：民用机场设施、民用机场运行保障设备、飞行试验地面设备、飞行模拟与训练设备、航空测试与计量设备、航空地面试验设备、机载设备综合测试设备、航空制造专用设备、航空材料试制专用设备、民用航空器地面接收及应用设备、运载火箭地面测试设备、运载火箭力学及环境实验设备,,航空地面设备制造：民用机场设施、民用机场运行保障设备、飞行试验地面设备、飞行模拟与训练设备、航空测试与计量设备、航空地面试验设备、机载设备综合测试设备、航空制造专用设备、航空材料试制专用设备、民用航空器地面接收及应用设备、运载火箭地面测试设备、运载火箭力学及环境实验设备
223,16,航天器光机电产品、航天器温控产品、星上产品检测设备、航天器结构与机构产品制造,,航天器光机电产品、航天器温控产品、星上产品检测设备、航天器结构与机构产品制造
224,17,轻型燃气轮机制造,,轻型燃气轮机制造
225,18,豪华邮轮及深水（3000米以上）海洋工程装备的设计（限于合资、合作）,限于合资、合作,豪华邮轮及深水（3000米以上）海洋工程装备的设计
226,19,海洋工程装备（含模块）的制造与修理（中方控股）,中方控股,海洋工程装备（含模块）的制造与修理
227,20,船舶低、中速柴油机及其零部件的设计（限于合资、合作）,限于合资、合作,船舶低、中速柴油机及其零部件的设计
228,21,船舶低、中速柴油机及曲轴的制造（中方控股）,中方控股,船舶低、中速柴油机及曲轴的制造
229,22,船舶舱室机械的设计与制造（中方相对控股）,中方相对控股,船舶舱室机械的设计与制造
230,23,船舶通讯导航设备的设计与制造：船舶通信系统设备、船舶电子导航设备、船用雷达、电罗经自动舵、船舶内部公共广播系统等,,船舶通讯导航设备的设计与制造：船舶通信系统设备、船舶电子导航设备、船用雷达、电罗经自动舵、船舶内部公共广播系统等
231,24,游艇的设计与制造（限于合资、合作）,限于合资、合作,游艇的设计与制造
232,（二十）,电气机械及器材制造业,,电气机械及器材制造业
233,1,100万千瓦超超临界火电机组用关键辅机设备制造（限于合资、合作）：安全阀、调节阀,限于合资、合作,100万千瓦超超临界火电机组用关键辅机设备制造：安全阀、调节阀
234,2,燃煤电站、钢铁行业烧结机脱硝技术装备制造,,燃煤电站、钢铁行业烧结机脱硝技术装备制造
235,3,火电设备的密封件设计、制造,,火电设备的密封件设计、制造
236,4,燃煤电站、水电站设备用大型铸锻件制造,,燃煤电站、水电站设备用大型铸锻件制造
237,5,水电机组用关键辅机设备制造,,水电机组用关键辅机设备制造
238,6,输变电设备制造（限于合资、合作）：非晶态合金变压器、500千伏及以上高压开关用操作机构、灭弧装置、大型盆式绝缘子（1000千伏、50千安以上），500千伏及以上变压器用出线装置、套管（交流500、750、1000千伏，直流所有规格）、调压开关（交流500、750、1000千伏有载、无载调压开关），直流输电用干式平波电抗器，±800千伏直流输电用换流阀（水冷设备、直流场设备），符合欧盟RoHS指令的电器触头材料及无Pb、Cd的焊料,限于合资、合作,输变电设备制造：非晶态合金变压器、500千伏及以上高压开关用操作机构、灭弧装置、大型盆式绝缘子（1000千伏、50千安以上），500千伏及以上变压器用出线装置、套管（交流500、750、1000千伏，直流所有规格）、调压开关（交流500、750、1000千伏有载、无载调压开关），直流输电用干式平波电抗器，±800千伏直流输电用换流阀（水冷设备、直流场设备），符合欧盟RoHS指令的电器触头材料及无Pb、Cd的焊料
239,7,新能源发电成套设备或关键设备制造：光伏发电、地热发电、潮汐发电、波浪发电、垃圾发电、沼气发电、2.5兆瓦及以上风力发电设备,,新能源发电成套设备或关键设备制造：光伏发电、地热发电、潮汐发电、波浪发电、垃圾发电、沼气发电、2.5兆瓦及以上风力发电设备
240,8,额定功率350MW及以上大型抽水蓄能机组制造（限于合资、合作）：水泵水轮机及调速器、大型变速可逆式水泵水轮机组、发电电动机及励磁、启动装置等附属设备,限于合资、合作,额定功率350MW及以上大型抽水蓄能机组制造：水泵水轮机及调速器、大型变速可逆式水泵水轮机组、发电电动机及励磁、启动装置等附属设备
241,9,斯特林发电机组制造,,斯特林发电机组制造
242,10,直线和平面电机及其驱动系统开发与制造,,直线和平面电机及其驱动系统开发与制造
243,11,高技术绿色电池制造：动力镍氢电池、锌镍蓄电池、锌银蓄电池、锂离子电池、太阳能电池、燃料电池等（新能源汽车能量型动力电池除外）,,高技术绿色电池制造：动力镍氢电池、锌镍蓄电池、锌银蓄电池、锂离子电池、太阳能电池、燃料电池等（新能源汽车能量型动力电池除外）
244,12,电动机采用直流调速技术的制冷空调用压缩机、采用CO2自然工质制冷空调压缩机、应用可再生能源（空气源、水源、地源）制冷空调设备制造,,电动机采用直流调速技术的制冷空调用压缩机、采用CO2自然工质制冷空调压缩机、应用可再生能源（空气源、水源、地源）制冷空调设备制造
245,13,太阳能空调、采暖系统、太阳能干燥装置制造,,太阳能空调、采暖系统、太阳能干燥装置制造
246,14,生物质干燥热解系统、生物质气化装置制造,,生物质干燥热解系统、生物质气化装置制造
247,15,交流调频调压牵引装置制造,,交流调频调压牵引装置制造
248,（二十一）,通信设备、计算机及其他电子设备制造业,,通信设备、计算机及其他电子设备制造业
249,1,高清数字摄录机、数字放声设备制造,,高清数字摄录机、数字放声设备制造
250,2,TFT-LCD、PDP、OLED等平板显示屏、显示屏材料制造（6代及6代以下TFT-LCD玻璃基板除外）,,TFT-LCD、PDP、OLED等平板显示屏、显示屏材料制造（6代及6代以下TFT-LCD玻璃基板除外）
251,3,大屏幕彩色投影显示器用光学引擎、光源、投影屏、高清晰度投影管和微显投影设备模块等关键件制造,,大屏幕彩色投影显示器用光学引擎、光源、投影屏、高清晰度投影管和微显投影设备模块等关键件制造
252,4,数字音、视频编解码设备，数字广播电视演播室设备，数字有线电视系统设备，数字音频广播发射设备，数字电视上下变换器，数字电视地面广播单频网（SFN）设备，卫星数字电视上行站设备，卫星公共接收电视（SMATV）前端设备制造,,数字音、视频编解码设备，数字广播电视演播室设备，数字有线电视系统设备，数字音频广播发射设备，数字电视上下变换器，数字电视地面广播单频网（SFN）设备，卫星数字电视上行站设备，卫星公共接收电视（SMATV）前端设备制造
253,5,集成电路设计，线宽0.18微米及以下大规模数字集成电路制造，0.8微米及以下模拟、数模集成电路制造，MEMS和化合物半导体集成电路制造及BGA、PGA、CSP、MCM等先进封装与测试,,集成电路设计，线宽0.18微米及以下大规模数字集成电路制造，0.8微米及以下模拟、数模集成电路制造，MEMS和化合物半导体集成电路制造及BGA、PGA、CSP、MCM等先进封装与测试
254,6,大中型电子计算机、百万亿次高性能计算机、便携式微型计算机、每秒一万亿次及以上高档服务器、大型模拟仿真系统、大型工业控制机及控制器制造,,大中型电子计算机、百万亿次高性能计算机、便携式微型计算机、每秒一万亿次及以上高档服务器、大型模拟仿真系统、大型工业控制机及控制器制造
255,7,计算机数字信号处理系统及板卡制造,,计算机数字信号处理系统及板卡制造
256,8,图形图像识别和处理系统制造,,图形图像识别和处理系统制造
257,9,大容量光、磁盘驱动器及其部件开发与制造,,大容量光、磁盘驱动器及其部件开发与制造
258,10,高速、容量100TB及以上存储系统及智能化存储设备制造,,高速、容量100TB及以上存储系统及智能化存储设备制造
259,11,计算机辅助设计（三维CAD）、辅助测试（CAT）、辅助制造（CAM）、辅助工程（CAE）系统及其他计算机应用系统制造,,计算机辅助设计（三维CAD）、辅助测试（CAT）、辅助制造（CAM）、辅助工程（CAE）系统及其他计算机应用系统制造
260,12,软件产品开发、生产,,软件产品开发、生产
261,13,电子专用材料开发与制造（光纤预制棒开发与制造除外）,,电子专用材料开发与制造（光纤预制棒开发与制造除外）
262,14,电子专用设备、测试仪器、工模具制造,,电子专用设备、测试仪器、工模具制造
263,15,新型电子元器件制造：片式元器件、敏感元器件及传感器、频率控制与选择元件、混合集成电路、电力电子器件、光电子器件、新型机电元件、高分子固体电容器、超级电容器、无源集成元件、高密度互连积层板、多层挠性板、刚挠印刷电路板及封装载板,,新型电子元器件制造：片式元器件、敏感元器件及传感器、频率控制与选择元件、混合集成电路、电力电子器件、光电子器件、新型机电元件、高分子固体电容器、超级电容器、无源集成元件、高密度互连积层板、多层挠性板、刚挠印刷电路板及封装载板
264,16,触控系统（触控屏幕、触控组件等）制造,,触控系统（触控屏幕、触控组件等）制造
265,17,发光效率100lm/W以上高亮度发光二极管、发光效率1001m/W以上发光二极管外延片（蓝光）、发光效率1001m/W以上且功率200mW以上白色发光管制造,,发光效率100lm/W以上高亮度发光二极管、发光效率1001m/W以上发光二极管外延片（蓝光）、发光效率1001m/W以上且功率200mW以上白色发光管制造
266,18,高密度数字光盘机用关键件开发与生产,,高密度数字光盘机用关键件开发与生产
267,19,只读类光盘复制和可录类光盘生产,,只读类光盘复制和可录类光盘生产
268,20,民用卫星设计与制造（中方控股）,中方控股,民用卫星设计与制造
269,21,民用卫星有效载荷制造（中方控股）,中方控股,民用卫星有效载荷制造
270,22,民用卫星零部件制造,,民用卫星零部件制造
271,23,卫星通信系统设备制造,,卫星通信系统设备制造
272,24,卫星导航定位接收设备及关键部件制造,,卫星导航定位接收设备及关键部件制造
273,25,光通信测量仪表、速率10Gb/s及以上光收发器制造,,光通信测量仪表、速率10Gb/s及以上光收发器制造
274,26,超宽带（UWB）通信设备制造,,超宽带（UWB）通信设备制造
275,27,无线局域网（含支持WAPI）、广域网设备制造,,无线局域网（含支持WAPI）、广域网设备制造
276,28,40Gbps及以上速率时分复用设备（TDM）、密集波分复用设备（DWDM）、宽带无源网络设备（包括EPON、GPON、WDM-PON等）、下一代DSL芯片及设备、光交叉连接设备（OXC）、自动光交换网络设备（ASON）、40G/sSDH以上光纤通信传输设备制造,,40Gbps及以上速率时分复用设备（TDM）、密集波分复用设备（DWDM）、宽带无源网络设备（包括EPON、GPON、WDM-PON等）、下一代DSL芯片及设备、光交叉连接设备（OXC）、自动光交换网络设备（ASON）、40G/sSDH以上光纤通信传输设备制造
277,29,基于IPv6的下一代互联网系统设备、终端设备、检测设备、软件、芯片开发与制造,,基于IPv6的下一代互联网系统设备、终端设备、检测设备、软件、芯片开发与制造
278,30,第三代及后续移动通信系统手机、基站、核心网设备以及网络检测设备开发与制造,,第三代及后续移动通信系统手机、基站、核心网设备以及网络检测设备开发与制造
279,31,高端路由器、千兆比以上网络交换机开发与制造,,高端路由器、千兆比以上网络交换机开发与制造
280,32,空中交通管制系统设备制造（限于合资、合作）,限于合资、合作,空中交通管制系统设备制造
281,（二十二）,仪器仪表及文化、办公用机械制造业,,仪器仪表及文化、办公用机械制造业
282,1,工业过程自动控制系统与装置制造：现场总线控制系统，大型可编程控制器（PLC），两相流量计，固体流量计，新型传感器及现场测量仪表,,工业过程自动控制系统与装置制造：现场总线控制系统，大型可编程控制器（PLC），两相流量计，固体流量计，新型传感器及现场测量仪表
283,2,大型精密仪器开发与制造：电子显微镜、激光扫描显微镜、扫描隧道显微镜、电子探针、大型金相显微镜，光电直读光谱仪、拉曼光谱仪，质谱仪、色谱-质谱联用仪、核磁共振波谱仪、能谱仪、X射线荧光光谱仪、衍射仪，工业CT、450KV工业X射线探伤机、大型动平衡试验机、在线机械量自动检测系统、三座标测量机、激光比长仪，电法勘探仪、500m以上航空电法及伽玛能谱测量仪器、井中重力及三分量磁力仪、高精度微伽重力及航空重力梯度测量仪器，光栅尺、编码器,,大型精密仪器开发与制造：电子显微镜、激光扫描显微镜、扫描隧道显微镜、电子探针、大型金相显微镜，光电直读光谱仪、拉曼光谱仪，质谱仪、色谱-质谱联用仪、核磁共振波谱仪、能谱仪、X射线荧光光谱仪、衍射仪，工业CT、450KV工业X射线探伤机、大型动平衡试验机、在线机械量自动检测系统、三座标测量机、激光比长仪，电法勘探仪、500m以上航空电法及伽玛能谱测量仪器、井中重力及三分量磁力仪、高精度微伽重力及航空重力梯度测量仪器，光栅尺、编码器
284,3,高精度数字电压表、电流表制造（显示量程七位半以上）,,高精度数字电压表、电流表制造（显示量程七位半以上）
285,4,无功功率自动补偿装置制造,,无功功率自动补偿装置制造
286,5,安全生产新仪器设备制造,,安全生产新仪器设备制造
287,6,VXI总线式自动测试系统（符合IEEE1155国际规范）制造,,VXI总线式自动测试系统（符合IEEE1155国际规范）制造
288,7,煤矿井下监测及灾害预报系统、煤炭安全检测综合管理系统开发与制造,,煤矿井下监测及灾害预报系统、煤炭安全检测综合管理系统开发与制造
289,8,工程测量和地球物理观测设备制造：数字三角测量系统、三维地形模型数控成型系统(面积＞1000×1000mm、水平误差＜1mm、高程误差＜0.5mm）、超宽频带地震计(φ＜5cm、频带0.01-50Hz、等效地动速度噪声＜10-9m/s)、地震数据集合处理系统、综合井下地震和前兆观测系统、精密可控震源系统、工程加速度测量系统、高精度GPS接收机（精度1mm+1ppm）、INSAR图像接收及处理系统、INSAR图像接收及处理系统、精度＜1微伽的绝对重力仪、卫星重力仪、采用相干或双偏振技术的多普勒天气雷达、能见度测量仪、气象传感器（温、压、湿、风、降水、云、能见度、辐射、冻土、雪深）、防雷击系统、多级飘尘采样计、3-D超声风速仪、高精度智能全站仪、三维激光扫描仪、钻探用高性能金刚石钻头、无合作目标激光测距仪、风廓线仪（附带RASS）、GPS电子探控仪系统、CO2/H2O通量观测系统、边界层多普勒激光雷达、颗粒物颗粒经谱仪器（3nm-20μm）、高性能数据采集器、水下滑翔器,,工程测量和地球物理观测设备制造：数字三角测量系统、三维地形模型数控成型系统(面积＞1000×1000mm、水平误差＜1mm、高程误差＜0.5mm）、超宽频带地震计(φ＜5cm、频带0.01-50Hz、等效地动速度噪声＜10-9m/s)、地震数据集合处理系统、综合井下地震和前兆观测系统、精密可控震源系统、工程加速度测量系统、高精度GPS接收机（精度1mm+1ppm）、INSAR图像接收及处理系统、INSAR图像接收及处理系统、精度＜1微伽的绝对重力仪、卫星重力仪、采用相干或双偏振技术的多普勒天气雷达、能见度测量仪、气象传感器（温、压、湿、风、降水、云、能见度、辐射、冻土、雪深）、防雷击系统、多级飘尘采样计、3-D超声风速仪、高精度智能全站仪、三维激光扫描仪、钻探用高性能金刚石钻头、无合作目标激光测距仪、风廓线仪（附带RASS）、GPS电子探控仪系统、CO2/H2O通量观测系统、边界层多普勒激光雷达、颗粒物颗粒经谱仪器（3nm-20μm）、高性能数据采集器、水下滑翔器
290,9,环境监测仪器制造：SO2自动采样器及测定仪、NOX及NO2自动采样器及测定仪、O3自动监测仪、CO自动监测仪、烟气及Pm2.5粉尘采样器及采样切割器、便携式有毒有害气体测定仪、空气中有机污染物自动分析仪、COD自动在线监测仪、BOD自动在线监测仪、浊度在线监测仪、DO在线监测仪、TOC在线监测仪、氨氮在线监测仪、辐射剂量检测仪、射线分析测试仪、重金属在线监测设备、在线生物毒性水质预警监控设备,,环境监测仪器制造：SO2自动采样器及测定仪、NOX及NO2自动采样器及测定仪、O3自动监测仪、CO自动监测仪、烟气及Pm2.5粉尘采样器及采样切割器、便携式有毒有害气体测定仪、空气中有机污染物自动分析仪、COD自动在线监测仪、BOD自动在线监测仪、浊度在线监测仪、DO在线监测仪、TOC在线监测仪、氨氮在线监测仪、辐射剂量检测仪、射线分析测试仪、重金属在线监测设备、在线生物毒性水质预警监控设备
291,10,水文数据采集、处理与传输和防洪预警仪器及设备制造,,水文数据采集、处理与传输和防洪预警仪器及设备制造
292,11,海洋勘探监测仪器和设备制造：中深海水下摄像机和水下照相机、多波束探测仪、中浅地层剖面探测仪、走航式温盐深探测仪、磁通门罗盘、液压绞车、水下密封电子连接器、效率＞90%的反渗透海水淡化用能量回收装置、海洋生态系统监测浮标、剖面探测浮标、一次性使用的电导率温度和深度测量仪器(XCTD)、现场水质测量仪器、智能型海洋水质监测用化学传感器(连续工作3~6个月）、电磁海流计、声学多普勒海流剖面仪（自容式、直读式和船用式）、电导率温度深度剖面仪、声学应答释放器、远洋深海潮汐测量系统（布设海底）,,海洋勘探监测仪器和设备制造：中深海水下摄像机和水下照相机、多波束探测仪、中浅地层剖面探测仪、走航式温盐深探测仪、磁通门罗盘、液压绞车、水下密封电子连接器、效率＞90%的反渗透海水淡化用能量回收装置、海洋生态系统监测浮标、剖面探测浮标、一次性使用的电导率温度和深度测量仪器(XCTD)、现场水质测量仪器、智能型海洋水质监测用化学传感器(连续工作3~6个月）、电磁海流计、声学多普勒海流剖面仪（自容式、直读式和船用式）、电导率温度深度剖面仪、声学应答释放器、远洋深海潮汐测量系统（布设海底）
293,12,1000万像素以上数字照相机制造,,1000万像素以上数字照相机制造
294,13,办公机械制造：多功能一体化办公设备（复印、打印、传真、扫描），彩色打印设备，精度2400dpi及以上高分辨率彩色打印机头，感光鼓,,办公机械制造：多功能一体化办公设备（复印、打印、传真、扫描），彩色打印设备，精度2400dpi及以上高分辨率彩色打印机头，感光鼓
295,14,电影机械制造：2K、4K数字电影放映机，数字电影摄像机，数字影像制作、编辑设备,,电影机械制造：2K、4K数字电影放映机，数字电影摄像机，数字影像制作、编辑设备
296,（二十三）,工艺品及其他制造业,,工艺品及其他制造业
297,1,洁净煤技术产品的开发利用及设备制造（煤炭气化、液化、水煤浆、工业型煤）,,洁净煤技术产品的开发利用及设备制造（煤炭气化、液化、水煤浆、工业型煤）
298,2,煤炭洗选及粉煤灰（包括脱硫石膏）、煤矸石等综合利用,,煤炭洗选及粉煤灰（包括脱硫石膏）、煤矸石等综合利用
299,3,全生物降解材料的生产,,全生物降解材料的生产
300,4,废旧电器电子产品、汽车、机电设备、橡胶、金属、电池回收处理,,废旧电器电子产品、汽车、机电设备、橡胶、金属、电池回收处理
301,三、,制造业,,制造业
302,（一）,农副食品加工业,,农副食品加工业
303,1,豆油、菜籽油、花生油、棉籽油、茶籽油、葵花籽油、棕榈油等食用油脂加工（中方控股），大米、面粉加工，玉米深加工,中方控股,豆油、菜籽油、花生油、棉籽油、茶籽油、葵花籽油、棕榈油等食用油脂加工，大米、面粉加工，玉米深加工
304,2,生物液体燃料（燃料乙醇、生物柴油）生产（中方控股）,中方控股,生物液体燃料（燃料乙醇、生物柴油）生产
305,（二）,饮料制造业,,饮料制造业
306,1,黄酒、名优白酒生产（中方控股）,中方控股,黄酒、名优白酒生产
307,（三）,烟草制品业,,烟草制品业
308,1,打叶复烤烟叶加工生产,,打叶复烤烟叶加工生产
309,（四）,印刷业和记录媒介的复制,,印刷业和记录媒介的复制
310,（五）,石油加工、炼焦及核燃料加工业,,石油加工、炼焦及核燃料加工业
311,1,1000万吨/年以下常减压炼油、150万吨/年以下催化裂化、100万吨/年以下连续重整（含芳烃抽提）、150万吨/年以下加氢裂化生产,,1000万吨/年以下常减压炼油、150万吨/年以下催化裂化、100万吨/年以下连续重整（含芳烃抽提）、150万吨/年以下加氢裂化生产
312,（六）,化学原料及化学制品制造业,,化学原料及化学制品制造业
